{
  "schemaVersion": "v1",
  "requestId": "6f5f34e7-1f8d-4ca8-a4ec-8be2f2a91d3a",
  "seed": 321,
  "patch": [
    {
      "op": "addStoryBeat",
      "opId": "op_director_story_1",
      "beatId": "BEAT_SAMPLE_1",
      "text": "Rations tighten this season; avoid expansion and secure food routes.",
      "durationTicks": 24
    },
    {
      "op": "setColonyDirective",
      "opId": "op_director_nudge_1",
      "colonyId": 0,
      "directive": "PrioritizeFood",
      "durationTicks": 18
    }
  ],
  "explain": [
    "directorStage:mock",
    "directorOutputMode:both",
    "budgetUsed:0.000",
    "MockPlanner produced deterministic director checkpoint output.",
    "Given the same goal, seed, and tick, this service returns the same patch."
  ],
  "warnings": []
}
