{
  "schemaVersion": "v1",
  "requestId": "0da6ce2c-57aa-44ca-aafa-bf29caea89ef",
  "seed": 99,
  "patch": [
    {
      "op": "addWorldEvent",
      "opId": "op_EHEXWRJLIOXY",
      "eventId": "WEATHER_2NX253AKWZ0L7",
      "type": "RAIN_BONUS",
      "params": {
        "severity": 2,
        "region": "GLOBAL"
      },
      "durationTicks": 17
    }
  ],
  "explain": [
    "MockPlanner produced a deterministic response for pipeline testing.",
    "Given the same goal, seed, and tick, this service returns the same patch."
  ],
  "warnings": []
}
